,Relevant Comments,Components List
0,i believe the stainless steel model also have sapphire crystal display rather than glass not just the ultra,['display']
1,is the always on display really that useful or useless how often do you use it,['display']
2,7 wa a minor upgrade to 6 8 an even minor to 7 same cpu since 6 not even shrinked to 5nm still 7nm so no better battery display a little bit smaller but who care will stick to my 6,"['display', 'battery']"
3,how is a se for kid because it doe not have always on display wa everyone kid when they bought the series 3,['display']
4,when you guy get the new iphones please compare the 14 pro and 14 pro max thermal and performance cause some leaked benchmark point to a 17percent faster cpu while other to a barley faster one could it just be the a15 in the normal 14 that get barley above last year s phone i really need to know if their is any difference between the pro and pro max other than the battery and display size before getting one thanks,"['display', 'battery']"
5,what doe the screen brightness have to do with it looking toyish or not lol it will likely have an ambient light sensor which mean it will only reach 2000nits in the very brightest outdoor condition you do not want that thing blaring at 2000 nit very often not only will the pretty poor battery life be even poorer but the oled display will take a beating aswell brightness and oled is do not go well they degrade faster the brighter they go,"['display', 'ambient light sensor', 'battery']"
6,i have the series 5 and i feel like the current se would be fine for me i do not use the always on display,['display']
7,6 33 from my first day of using apple watch i set the display to list view style,['display']
8,the sapphire display on the apple watch ultra is not pure sapphire meaning it still scratch where regular gorilla glass would apple should not be claiming that it ha a sapphire display because of this,['display']
9,bro had the stickman display explanation backwards,['display']
10,i been debating on getting the ultra because i like the orange display at night and screen size and the orange band but i want to know what health feature it ha i have never had an apple watch the last thing is i feel like it would be too much tech i have an iphone 11 pro my second iphone ever and an ipod any suggestion for getting it,['display']
11,i have to say something i have been using apple watch 5 since it release the display ha cracked and crown wa gone over this time one fixed from pocket one fixed by apple if i had an ultra these will not be happen i am just a normal everyday user it is only 100euros difference between steel version of series 8 and ultra so if the design is ok there is no excuse for using apple watch series 8,['display']
12,absolutely love this watch best apple watch to date overall regardless of how you want to use it in my opinion visit a store that ha one on display and put your hand on it may not be for everyone but this watch will surely be an enormous hit especially during the christmas season,['display']
13,i decided to charge my ultra and run it till the battery wa dead i performed my normal use a few phone call texting daily work out and kept on normal power mode and always on display i got exactly 54 hour and 10 minute big improvement,"['display', 'battery']"
14,man doing any smartphone stuff on that display would be as and probably make your finger cramp up in about 30 second,['display']
15,just ordered my ultra because i currently have a series 7 small screen product red i originally got solely for working out to replace my series 3 big display but found myself hating it cause of the battery and the size wa not big enough to do anything with plus always thought the watched looked ugly regardless of the size and color and resembled a spy kid watch looking forward to the ultra and seeing if the battery life and big screen make it a good solution a far a the spy kid look i would not be wearing any apple watch to the met gala anytime soon put it that way,"['display', 'battery']"
16,i think it look like one of the first smartwatches like a mini smartphone strapped to the wrist i am an extreme sport person skydive basejump wingsuit dive freedive rock climbing etc and to me the biggest issue is the form factor entanglement and battery life there no way 2 day is enough my go to watch is a garmin descent g1 solar it look like a gshock is super durable ha gps is a full blown dive computer without subscription and ha week of battery life with solar recharging to me the apple watch ultra is like a porsche suv it for people who want to feel a if without actually needing the functionality a hiker can use the normal apple watch a runner a well a real diver not just 1 2 scuba dive occasionally per year would not trust this watch in the mountain and snow the cold will drain the battery even faster i also do not like the display bright sunlight and polarized sunglass will make it hard to read garmin us a technology where the watch becomes better readable the more sunlight reflects off the screen,"['display', 'battery']"
17,their strategy for this replacing ultra watch dive computer reminds me of how they targeted expensive color correction monitor with the pro display,['display']
18,i still think for hiking other outdoor activity and battery life the garmin fenix 7 7 7x is the way to go my fenix 7x with everything turned always on display except the 5 satellite my battery last 3 week if you turn every extra stuff off then the battery last 1 year if i have the 5 satellite turned on for hiking and other activity then the battery last 48 hour the garmin map and tracking are superior for hiking and ultra marathon most people do not know about the garmin fenix and epic watch you should check them out,"['display', 'battery']"
19,4m view but yet you fail to mention the ultra doe not have edge to edge display what a step backwards who care about a 49mm screen if the display is only 47mm with an unusable black bezel around the display how irresponsible of apple to fail to mention this going right back they are not getting my dollar800 to downgrade,['display']
20,love the new design of this new apple watch ultra however i think apple should also get a smaller size a displayed on the apple watch 8 so people with smaller wrist can also enjoy the funky design too,['display']
21,pro actually ha more of an elegant feel not a rugged feel okay perhaps not the pro display but everything else,['display']
22,imagine solar panel under the display that would be a game changer,['display']
23,did you have display on through your test,['display']
24,actually iwatch ultra is a watch for people who want to display status on their wrist people who do those extreme type of sport are better off with a watch that is specifically made for their type of activity and that is what you gon na see in the end like 90percent of people who will wear this watch will propably use it to check their message,['display']
25,i am just a regular user who need a resistant case to my job in an ambulance and like the design or the bigger display and more brightness from the ultra and i am not in your draw,['display']
26,unske the dual frequency gps is super useful for me with photography and i will leave my phone at home when i go out it also ha very good triangulation with the mics so no wind noise come in i also can take this watch skiing and have a big enough display for my huge hand the night display help with night photography it is great for me to each their own,['display']
27,impressive feature and beautiful display but miss the mark big clunky and mediocre battery life this ultramarathoner will stick with coros,"['display', 'battery']"
28,apple ha really upped their game with this watch i am impressed however i am an avid garmin fenix 7x user and previous 6x owner i know the ultra should be compared to the epix 2 based on battery life and screen but i opted for the bigger and better for longevity i think apple is on the right track if their goal is to keep gain even the extreme adventurer interested i must say i am really digging the look of this ultra and would love to see where they go with it there are some small feature on the ultra i wish would be on the fenix but it go both way even though the fenix 7x is a little overkill for my us it still brings an app that is a capable on android a it is on io it is not an amoled screen but it still touch capable and the reflective display is super readable in sunlight and add to the overall 28 day average batter life fenix 7x is a watch i know i can also make last 5 year minimum with feature that will be a strong then a they are now,"['display', 'battery']"
29,the best fitness tracker doe not even have a display all apple needed to do wa make the 8 slightly thicker for the battery charged 600 rather than 800 and called it a pro,"['display', 'battery']"
30,with the regular apple watch 8 or se could i get 2 day if i turn off always on display and use it lightly,['display']
31,this watch ha an absolutely enormous pull for me a an astronomer it ha a red filter for the display which is absolutely crucial for astronomy to protect night vision my current apple watch if i accidentally tilt my wrist kill my night vision however the biggest reason is the waypoint marker often u astronomer need to travel far and to remote location to find darker sky my closest dark sky area is beautiful but ha absolutely zero signal of any degree and can be pretty easy to get lost something like the waypoint marker if accurate and reliable would massively increase my confidence and enjoyment traveling to remote site and further my enjoyment of astronomy,"['display', 'display']"
32,is the display flippable so that the crown can be on the left for ppl who prefer to where the watch on right wrist,['display']
33,i just think it crazy apple sell a 60hz display phone for 900 buck in 2022,['display']
34,ha nobody here heard of the garmin epix it blow the apple watch out of the water except for one thing it is not in the apple ecosystem but still having owned both i sticked with the epix because of the 2 week battery life with always on display very accurate metric the button all the available information in widget and not almost everybody already wear a garmin epix unlike a apple watch,"['display', 'battery']"
35,i have been using a huawei watch gt2 for the last couple of year it doe not have all the function of android or apple but i get my notification and can answer or decline phonecalls and it also show the time but the battery life is just insane i get a full week with always on display last night when i came home around 5pm i had 13percent battery left i wa like eh i will charge it tomorrow night,"['display', 'battery']"
36,marque if you are wearing your watch on the right arm please rotate the display in setting so the crown is easier to access,['display']
37,what kind of car do you drive that ha that huge display,['display']
38,see viewer how apple fan boy aka digital slave justify that 800dollar when pixel 6a came with 60hz display this guy just criticize but now ip14 and again 800dollar iwatch these manipulator are the cancer of tech world,['display']
39,my apple watch series 3 just broke i bought the apple watch ultra do i scuba dive no do i do trialthalons no do i want a longer battery life bigger display and a cooler looking watch yes mine should arrive in two day excited,"['display', 'battery']"
40,speaking from an electrical engineering nerd perspective i just geek had to have it for the large display i am a big guy too so the large size will not bother me also being in my mid 40 is helping out my eyesight a well also big upgrade for me a i am still rocking a series 2 apple watch can not wait for my delivery,['display']
41,a someone who dive recreational it probably will not replace my dive computer yet i am excited to see the next generation on what it can possibly do though the current pro i see automatically log your dive if you do electronic dive log share your dive with everyone else perhaps give you more tangible feedback if you are ascending or descending too quickly like bigger vibration sometimes hearing the beep in the ocean is quite hard what i hope it can do in the future gps tracking of all of your dive buddy and group if they wear the ultra or some water proof airtag there were moment where i dove with only 1m of visibility so it can be hard to track anyone down there if they had a radar display or an arrow that point where your dive buddy is and how far that will be neat,['display']
42,2 full day with always on display on or off did not mention bro,['display']
43,1 on this i have had apple watch since the very first one and do not use any of the health or fitness feature at all so while i will happily take the extra battery life i do not really need it since i already finish the day with gt 50percent battery life however the ultra appeal to me because the display technically cover glass of my apple watch get so beat up and putting a screen protector on the curved glass look feel weird to me so i do not,"['display', 'battery']"
44,i tried the series 2 and series 5 both left me disappointed a fitness watch one of my complaint wa the button not enough button to be able to do thing during run and when sweat wa everywhere maybe 1 extra button plus the crown for scrolling will fix that the native exercise apps never impressed me and did not display the data i wanted or in the configuration i wanted i like the apple watch a a smart watch and fashion statement and always wanted it to work a both but now the ultra ha the sport capability and the look is not sleek and fashionable a the base model so it still doe not work for me i will keep my garmin i guess,['display']
45,my series 5 which i am replacing ha 88percent battery health and i have to charge more than once a day i have to run the display at max brightness to read it in all condition maybe it is because i am getting older and the eye are not all they once were but that also drain the battery more i figure the ultra will age much more gracefully for me extended battery life and brightness mean even a component degrade they will probably still be a good a the normal watch of course you get the extra stuff too though at 69 i will not be climbing everest or shooting the rapid but no one ha ever cursed extra durability or battery life i will probably wear it with a pedestrian apple leather link band and will enjoy the bigger display and the keyboard ever try to draw a password on a aw5 an exercise in frustration best to have your phone nearby so you can use it is keyboard,"['display', 'battery']"
46,i ordered one instantly on day one after the conference i may not need all it sport feature but i surely do want bigger display longest batter life ever and the brightest screen for outdoor use,['display']
47,please apple just give u a reflective transflective display quit trying to fight the sun with photon you are so close to practicality,['display']
48,the reason i am considering buying one of these flat screen curved screen are the worst thing to happen to mobile electronics because screen protector are inefficient and sometimes un doable if a fingerprint sensor is in the display samsung had to know about this before they introduced this plague onto the market but for some reason every engineer threw logic out of the window because they look cool or something it is the main reason i switched ecosystem no stupid curved screen or in screen fingerprint sensor imagine my frustration when i buy a series 7 apple watch and find my actual worst nightmare a flimsy curved screen that scratch if you look at it too often,['display']
49,if i am spending dollar800 on a smart watch it better have a battery way longer than 2 day i really hope hybrid screen with either e ink or layered segment display get some investment for this reason,"['display', 'battery']"
50,i hope they make an iphone ultra would love a flat display with a lip like that to make it rugged and not need an additional case,['display']
51,something some folk miss is that larger display mean easier for people with poor vision to read larger control mean easier to manipulate so if you are a larger older person this watch is more appealing than if you are a smaller or younger person before you even get to the other feature add being clumsy on top of it and yeah the ruggedness is nice too,['display']
52,i work outside with park and recreation a a groundskeeper and pre ordered this just for the ruggedness the flat display hopefully will keep dust and particle out of the bezel gap which is the main thing that drive me crazy about the regular apple watch a screen protector also never worked on the curved display a it would bubble up and peel after a couple of week i can not wait,['display']
53,sad part is that i really wanted a flat display i do not care about any of the other feaures just give me a flat glass screen like the iphones have the curved bezel make it impossible to use a screen protector my iphone 14 pro max ha flat glass my iphone 11 did not and the screen protector can go right against the edge that is all i need no curve no fat glass that is rounded off to give a depth 3d look this weighs more and is not needed apple should offer a watch 8 pro that follows the iphone pro design language,['display']
54,8 25 no i am not somebody who never owned a watch i just like the new form factor and especially the all flat display that is much better readable,['display']
55,please also review a garmin forerunner or enduro model to understand why ultra triathlon sporters use them a lot on the biking leg of a triathlon i really prefer to have my garmin bike computer edge 530 displaying bike gear power data heart rate cadence etc on a much bigger screen but much more important is garmin connect and the way it us all that data to give advice on training status readiness and many more data point if you want to use data to optimize your endurance activity a garmin is still the best choice for for casual endurance event finishing an ironman once to scratch it off a bucket list the apple watch ultra is sufficient,['display']
56,a an ultra runner and fan of apple product i have to say this watch doe not deliver what i find in a garmin or similar watch it would be a long list to compile my thought but two stick out the still lacking battery life not for one activity but over a full week of training and the lack of button there is so much muscle memory built into the way i use my garmin on the garmin i can go blindly to a specific data point while running i can not on a touch display or with the crown i still see this watch a a lifestyle item edit even more importantly this apple watch lack any recovery metric which is a major factor for judging training,"['display', 'battery']"
57,i do not need the ultra at all i have had the series 3 4 amp 6 all in stainless steel i am going to upgrade my series 6 to the ultra mainly because the series 8 is not much different to the 6 the cost difference is not a lot and i want a different design i will never use the diving hiking or mountain feature but doe that mean this watch is not for me i do not like how sometimes apple seems to suggest just because you will not use the feature the watch wa designed for that you should just get the se i want a bigger brighter screen i want a better battery same thing with the macbooks i am not a pro at all in any sense but i still prefer the macbook pro over the air and i usually want the 16inch pro just for the display quality and battery size my point is i always feel like i should not be buying these product or feel guilty for buying them just because they are not designed for my life case great video a always,"['display', 'battery']"
58,it is titanium ha a sapphire crystal display and an extra programmable button enough get on my wrist,['display']
59,maybe in future they will make a ultra iphone mkbhd it sound like that phone will be harder to brake i wish they make iphone ultra one some day and that can go 100 meter deep sapphire display it will be cool,['display']
60,i have a letsfit iw2 smartwatch it cost me 40 freedom unit shipped to my door doe everything a basic smartwatch need to do along with some custom display an app for android that work well the company is based out of fla i have had people who do not know ask if it is an apple watch and best of all the dang thing last nearly 10 day on a charge apple want 800 freedom unit for their watch and for what i need in a watch hell no,['display']
61,get a garmin watch it gps is awsome it is way way better than apple at golf with not a nice a display,['display']
62,i personally wish the regular watch did not have a curved display,['display']
63,my apple watch series 8 is coming today very excited i actually wanted the ultra but mostly for the battery life and the flat display but after thinking it over i just could not justify dollar800 for a watch that only had two feature i liked the rest of the feature i would probably never use it is a nice watch though it is also huge and i am a small female so it would probably be too big for my wrist apple please make a female version of the ultra,"['display', 'battery']"
64,i am actually surprise that this watch is compelling to me the gen 7 watch requires me to charge mid hike if i track my workout or else i risk loosing it also in the middle of the day heat in the desert i normally have to turn and place my watch in my shadow to see the screen lastly in 112 degree heat i found the watch overheated and would not display data i hope this ultra watch can stand up to the heat better the gps might be somewhat useful for navigating canyon where gps tends to get squirly but it not often you get lost in a canyon because there is normally only two direction to navigate,['display']
65,definitely overkill for me but i have a series 4 and had been wanting to update to a watch with always on display so i have an ultra on order people were expecting this pro watch to be over dollar1k which would have been an easy pas for me when it came in at dollar799 it made it appear a a bargain and motivated people to buy i think apple planted those gt dollar1k rumor,['display']
66,that is the same spot i am in i have a 4 which is still kicking but i would love an always on display,['display']
67,and they last for week longer than apple is watch ultra even in the ultra is 60 hour battery saving mode apple writes in the fine print of the product page that it turn off the heart rate and gps sensor just to make it last that long garmin ha both heart rate and gps going for at least 96 hour and multiple day longer if gps is turned off apple would have to change the display technology completely to be able to get it to last longer than 60 hour,"['display', 'battery']"
68,wonder how battery life and display match between samsung watch 5 pro and apple watch 8 ultra naming scheme go burrr,"['display', 'battery']"
69,funny how smartwatch battery is so important but no one talk about the amazfit smsrtwatches charged my gts 3 friday with always on display and notification on today is wednesday and i am still at 47percent,"['display', 'battery']"
70,review keep saying this is designed for the extreme user marcus briefly touched on who will truly buy this watch those people who simply want a better apple watch period who doe not want 2 3 day battery life who would not love a brighter display so it is big so what i am a bigger guy and this probably will not look too out of place on me this watch will sell ton and ton for every 1 person that buy it because they are an ultra marathoner or scuba diver they will sell 99 to an average person who will never use 99percent of the ultra feature i would not be surprised if in 2 or 3 year this rugged version becomes the normal version we could see a smaller 44 or 45 mm version for smaller wrist etc stop trying to convince average user that they should buy the se because it is all they will ever need the fact appears to be that the ultra is a good watch better in every way and that is why they will sell million,"['display', 'battery']"
71,nice review now i have to wait till november to get mine that flat display tho velcro strap are the way to go all my casios have velcro and this one will too by 3rd gen this watch will be solar thanks,['display']
72,2 day and night with always on display or without,['display']
73,apple can make regular apple watch with bigger battery and flat display but they will not because all they want is your hard earned money,"['display', 'battery']"
74,were you also using always on display when you got 2 5 day out of it thanks,['display']
75,this is way smaller and cheaper than my garmin watch i love the way it look and although my garmin epix 2 with oled display can last a full week even with heavy use i really like the look of this watch and the fact that it will complement the rest of the apple ecosystem,['display']
