,Relevant Comments,Components List
318,there is one point i would like to find out that apple watch ultra is targeting extreme weather sport i just wonder that how the battery design facing those condition are they using enduro battery design,['battery']
319,i love the look of the ultra and the hardened feature but i hesitate to spend dollar800 on a watch that is battery will degrade in a couple year time no matter what you do i will stick with the normal apple watch for almost half the cost of the ultra,['battery']
320,a couple thing 1 sleep tracking is useless you do not need a watch to tell you if you had a good night rest and it feel uncomfortable wearing a watch while sleeping i find it unnecessary 2 battery life is overrated at least in the aspect of comparing 60 hour to 1 week like other watch it take literally zero effort to put the device on a charger at night 3 this watch is not even big it also still light garmin amp suunto are literally monster and twice the price can not justify spending 1500 for a smartwatch but the 800 is just right i mean there are people who spend 2k on a regular watch that doe nothing but tell time having said that i am considering this now too i have the series 7 but the face is already scratched from kayaking trip and kettlebells i hike in warmer month and the extra battery is good for camping trip when i am outside for 2 day but definitely do not need a week worth of battery but a weekend worth is perfect the waypoint is definitely a game changer,['battery']
321,dollar800 watch battery should last at least a week lmao,['battery']
322,if battery last for more than a week then it name is suitable otherwise it is just name ultra,['battery']
323,this is why i hate smart watch a good g shock will last decade and if the battery dy it is easy to unscrew the back and put a new coin cell in,['battery']
324,for the second group that doe long hiking it still miss too much good offline map are an essential thing which is missing on the apple watch and the battery life is still bad compared to the garmin watch specialized on that particular group the two band gps is not really knew other specialized watch have that too,['battery']
325,i wish there phone had this battery life personally i do not find the watch appealing i see no use for it,['battery']
326,i thought i would be in to this watch using it the same a my other apple watch the battery will not last until evening the first day the cellular doe not work well enough to use alone without the phone spotify would not work with my airpods i could only play music i had downloaded to my watch the workout app constantly pause right in the middle of my workout i left my phone in the locker at the gym with cellular bluetooth and wi fi turned off and my watch kept trying to play music on it successfully instead of my airpods it is a cool looking watch though and it is not a huge watch like i keep hearing everyone say if you think it is huge you should probably eat more protein or something because you obviously have tiny dainty wrist,['battery']
327,ngl i am a hardcore android user but the apple watch ha me thinking and the more or le 3 day of battery ha me hooked just need to buy an iphone,['battery']
328,00 15 69percent battery nice mkbhd,['battery']
329,it is cool but it is also going to be trash in a few year when you want an upgrade i would actually be interested in this watch if it wa more of a life time or 20 year proposition where the internal component could be updated paying this much money for something which will be obsoleted next year seems weird to me seems like an expensive toy i do have a garmin forerunner 945 i get week of battery and i love it it is a smart watch but it is also kind of dumb and feel like something i could have for a long time although i guess the battery will go sooner or later and it will be headed for the landfill,['battery']
330,that is great battery life but dollar800 i do not mind charging mine lol,['battery']
331,they should try making the ultra longer battery maybe 5 day or up maybe all will drool on the watch i will want it if it 5days 2 day is ok but let be practical,['battery']
332,it is the battery if you want an apple watch you would like to wear it all day then wear through the night at time to monitor sleep and health for the benefit it is designed to provide without charging it every day,['battery']
333,an apple watch is limited to battery power apple should made it with solar charging i wait for generation 15 and when the price is dollar399 00 instead of dollar799 00,['battery']
334,a bit late here but i am looking for this watch when the model arrives to my country i have an se and week ago i had to call an ambulance because of my heart i am a heart transplant patient when the ambulance arrived the guy noticed my watch asked for my phone and check the daily rhythm and other stats he double checked with the machine and all after that he told me that maybe a series 7 or 8 would be nice cause it have other useful stats and i wa like ok then the doctor at the emergency room took my phone and did the exact same thing after spent the night at the emergency room i asked them about the watch they told me that they obviously double check everything with specialized machinery but the watch and phone give them an analysis of what wa happening earlier that day and week and is a reaaaally good addition now looking at the ultra i am tempted because battery alarm sound because i am 70percent deaf and all the stuff that the se do not have now is expensive but having those stuff make me feel a little le worried when i am outside in other country or similar situation i am not an extreme user a apple show in the video but i think all the people with heart disease love the watch and they could focus on that and have a lot of new potential user old people transplanted person etc,['battery']
335,so lem me guess it straight apple expect u to buy a 1000dollar phone a 400 800dollar tablet and a 400 800dollar watch every 3 4 5 year a the battery becomes crap or the o becomes super outdated and or unsupported any middle class person who ha a family or a mortgage can not afford that crap unless you live on your credit card eat only unhealthy food like kraft diner r do not save money for rainy day it is not even close fun time we live in also all the environment friendly thing they claim to do when they try to push all these disposable gadget pure greenwashing android can be cheaper but is much worse for battery swapping or updating the o the only way i can afford gadget while paying my mortgage and being financially responsible saving money is buy them used in place like marketplace and run them into the ground until they basically explode,['battery']
336,2 5 day of battery charge will have to wait till it hit atleast 7 day since this will not do well with multi day trek,['battery']
337,i have a withings scanwatch it is not that smart a watch but it go about 4 week between charge apple ha just squared the reason i am still not buying any apple watch battery shape and size,['battery']
338,until the next update that decrease your battery drastically lol,['battery']
339,turn off cellular and tell u how long the battery lasted you never mentioned how well that worked,['battery']
340,the main question is have you used it when your phone is near by i have an apple watch series 4 and the battery doe not even last for 8 hour if i use it only with the cell option,['battery']
341,2 day lol fenix 7x take week to run out of battery even sense2 take almost whole week,['battery']
342,some people work on a google server floor and would like the battery life flashlight data to not have their phone going through a metal detector all day and have health issue where finally temperature tracking is on the apple watch lol,['battery']
343,the biggest problem with this apple watch is the price at that price it is in garmin fenix price point which ha a battery life of over 10 day it is feature are all higher spec that the apple watch it ha more accurate gps with 3 different source solar charging so the battery life is extended basically it ha load of feature that other watch already do better the lack of being able to connect to third party sensor like a chest strap is also frustrating if it were cheaper it would fill a space which doe not overlap with better device unfortunately it doe not,['battery']
344,i need some help my ultra i turn to low power mode by noon and still by 1600 i am at 20 30percent battery it not on cellular mode however i get hundred of outlook notification some advice from someone pls,['battery']
345,sound like you either have every single app running in the background constantly pinging and using up battery or you just got a bad battery in your watch i have had it for about 3 week and i have never had it last fewer than 2 full day,['battery']
346,not sure why everyone is praising the battery life i am laying in bed and it is gone down 3percent,['battery']
347,ended that day by going to sleep with about 69percent battery brief pause nice hahahahahaha,['battery']
348,my current apple watch series 5 get me throughout the day and ha lasted through all my half marathon a long a i remember to charge it it slipped off the charger and i almost lost the the last two mile of flying pig i do have issue sometimes with gps in city like chicago and manhattan the straight line that cut thru building and road are pretty annoying and mess with the pace but apple is made gps better with each watchos iteration i guess i do not absolutely need this version of the apple watch but i do like bigger watch face and the longer battery life will be nice my next run are vega and disney so gps will not be an issue but coming from series 5 i will get vox and that metric will be neat to see i will have to check out the band on your estore,['battery']
349,i am tired of buying a stainless steel or titanium watch sapphire crystal that is disposable in 5 year all these premium material in a disposable watch just doe not make sense with all the genius sitting at apple they need to re engineer the apple watch where you can replace the battery easily 4 screw and replace the battery i like to argue the the apple watch is more expensive that most swiss watch if you consider you have no watch after a few year it a houdini watch now you have it next you do not why did i come to this point i have the apple watch original series this is now considered vintage by apple can not service it the battery died i paid 1 099 for it in 2015 stainless and sapphire crystal 2015 wa not so long ago in the watch world this ultra watch will not even last 10 year so is not this so expensive to own and use you will be still rocking your rolex 30 year from now the economics of apple watch is just plain bad for u perfect for apple the richest company in the world,['battery']
350,battery with lte network or wifi or any other connection may be show true battery consumption,['battery']
351,answering my own question it is stronger strong enough to feel during vigorous exercise i am also getting 4 5 day battery life the watch is the best apple watch by far 8 10,['battery']
352,battery life is not anywhere what i need and you still need an iphone impressive nevertheless,['battery']
353,i just picked up the fenix 6 sapphire on sale to replace my apple watch just for the battery life i got tired of having to pack another charger around when i travel and go hunting i wa jealous of my buddy and their garmins and never having to charge them,['battery']
354,i have never had an apple watch and just got my first iphone 13 pro max since the iphone 4 for me i will probably never use half the stuff that is capable in the watch but i just wanted to have the best apple watch on the market so i bought it the battery life 2k nit and aesthetic are enough for me,['battery']
355,i just received the new ultra and the size is not a surprise from a 45mm i like the overall look but the battery is what i am waiting to see if it is going to do it for me i can not wait for that software update that is suppose to add more battery life a well the durability is what got me looking at this one a well i banged up my series 7 the glass around the curve wa always taking hit i like the flat top with the protective rim of the ultra it feel heavier to me than a 45mm when i put it on i wa like ok i thought the weight wa not a thing but it is noticeable,['battery']
356,apple watch ultra battery life suck ball compared to amazfit garmin fitbit,['battery']
357,good battery life until apple kill it next year with an update,['battery']
358,battery life is shit to begin with any other smartwatch destroys the watch ultra in battery life,['battery']
359,curious on what your setting are to get that kind of battery life that is well beyond apple is claim of 36 hour which is what i typically get,['battery']
360,i am a garmin fenix user and i laugh at this battery life i get 2 week minimum out of mine with ten of gps activity,['battery']
361,at 1 11 the airpod battery noise scared me and i had to listen again thought my airpods were dying,['battery']
362,why doe it not have a ultra low battery mode already,['battery']
363,wow 3 day battery life and all that can be yours for dollar800 apple can go suck a lemon,['battery']
364,i ended that day going to sleep with about 69percent battery nice,"['battery', 'battery']"
365,69percent battery nice getting a thumb up just for that,['battery']
366,garmin is laughing at that battery life,['battery']
367,garmin user here when apple can reach the 2 week battery life then i can think about switching,['battery']
368,marque 69 percent battery life nice lmaoooo,['battery']
369,i am 100percent happy with my garmin epix 2 with awesome screen offline map and 2 week battery life,['battery']
370,hey apple i do not care about sport diving or climbing i am a regular office worker with mostly outlook notification how about a week of battery life no thought so,['battery']
371,battery life is trash garmin 7 for me,['battery']
372,battery still suck people will still buy this for luxury not necessity,['battery']
373,the main reason i left behind my apple watch wa for battery life i really really liked my apple watch and what i wanted it to do i wanted it to track my sleep step and calorie i did not use most of the other stuff it could do i went over to a garmin forerunner 945 and like it too it doe a million thing i will never use but i literally get 8 10 day on a single charge i know there are a plethora of other smart watch that get 5 10 day on a single charge what the heck can not apple create a watch that doe that i am sure this new watch will get 3 5 day if you are not going crazy with every single feature for me i want sleep tracking step and track my workout that is it i might think about going back to the apple watch the ultra but 8 hundo is pretty steep my garmin wa 6 hundy which is a lot dollar200 more for the ultra it is dope though,['battery']
374,well i am no athlete but i am excited to try the sleep tracking coming from the series 5 though what i want to ask is how low can i get the battery while keeping it in a good cycle meaning i will not destroy the future battery of the apple watch for i remember back in the series 5 or so time it wa recommended to charge your watch and not let it go under 50percent of charge so i just want to ask how low can i push the battery without destroying the future use of the apple watch for all day and all night use,['battery']
375,you can utilize the feature of apple watch ultra if you are an athlete but man look at that it impressive especially the battery life i mostly use my apple watch to track my sleep i am not athlete nor heavy workout person but i still want that i think it is worth it to upgrade,['battery']
376,el a g itr n it is not a bad watch but personally i like the garmin tactix better i have used the ultra in the same situation i use the delta and the feature are a little better garmin is just an all around outdoor watch the ultra is not bad but i would use it if i had to the battery life between them both is just not comparable so if your planing on being out for day at a time i would not recommend the ultra i got the ultra more for when i am on my bike especially using the gps feature for when i am in the road i did test it out in the wood and it not bad just try to cary an external power supply,['battery']
377,ill stick to my garmin battery life is much better,['battery']
378,haha battery life is the only reason i want this watch,['battery']
379,it should have the battery life at least 5 day to compete with garmin all the feature are cool but those people would not budge in 36 hour battery life,['battery']
380,why i left apple watch is because of battery life i can not enjoy wearing my apple watch for at least a week without having it charged everyday so i am currently wearing garmin tactix 7 pro ballistic it last me month or so without charging same material a the new apple watch ultra it ha more what can apple watch ultra could offer for daily and other rugged activity,['battery']
381,returning mine today after work gave it a 24 hour test battery wa at 50percent after one full day going back to fitbit 5 day battery huge fail for apple,['battery']
382,battery huawei,['battery']
383,casio watch battery go 10 year,['battery']
384,i would buy it just for the better battery life phone clarity volume and gps i do not care about anything else,['battery']
385,i think this watch is not enough for the price gbp800 and you get 3 day if you are lucky all the people who this product is aimed at are probably already into the garmin ecosystem and have been using watch like the fenix with 21 day battery life for year,['battery']
386,if apple watch ultra can not connect to diving equipment it is useless for proper diver and it doe not have the tech to connect to your oxygen tank to see the oxygen level remaining apple watch ultra is a luxury item with a big battery it is not for diver and with screen at max brightness it will die long before you finish a very long bicycle race for example,['battery']
387,i wear an apple watch 5 45mm and i just got this and can not wait for the awesome battery life i am a woman and i like big watch,['battery']
388,stupid question but if this phone is for endurance athlete how would you charge your battery if you a hundred mile in the wood or on top of mount everest,['battery']
389,it amazes me how a dollar100 watch battery can last for over a week and a dollar800 watch battery can only last two day and you call that good a a matter of fact my health insurance sent me the watch for free that they paid dollar50 for,['battery']
390,i have my og galaxy watch and the battery last about 5 day straight,['battery']
391,i am probably considered an average user but the battery of the ultra is very appealing i use for sleep tracking for health so very appealing indeed to have a few day wear without charging is it nice looking on woman wrist too my wrist are kind of small so i worried about the aesthetic but it is very appealing especially for the charging great review thank you,['battery']
392,so basically it ha the amount of battery life a normal apple watch should already have lol,['battery']
393,im returning my se 2 for an ultra i do lot of activity outside and workout 5 day a week i feel like ultra is win for me and it different compared to other watch the battery life got my attention,['battery']
394,maybe it is just not convenient for enough people but i use my galaxy watch for week to well over a month without charging becasue i put in on battery only mode when i am not in need of additional feature of course charging is not really an issue either unless you are sleep tracking but it is just one of those thing that i do not understand how the battery life is an inconvenience there are plenty of time during the day when you can charge it up while doing something else,['battery']
395,i am really interested in this watch because of the longer battery life the compass and the red light filter while i understand that battery life is pretty limited on the normal apple watch i find that the compass app and the filter are thing they definitely could add i am not into any extreme sport though so i can not justify buying an apple watch ultra,['battery']
396,please come back in a month a let u now how the battery is holding i love my apple watch but it seems that everytime i get a new one the battery is good for only like a month and then i have to charge it every night,['battery']
397,i get 10 12 day of battery with my garmin fenix how are wearable user still putting up with daily charging,['battery']
398,the day my smartwatch only ha 3 day of battery life remaining is the day i throw it out,['battery']
399,a a motorcycle rider the apple watch is such a pain in the a the battery life is so bad and you always have to take the charging cable with you i wish there would be an apple watch that last 5 day which is great for a nice motorcycle trip or work week i wa really looking forward for the ultra but now i will look for an alternative,['battery']
400,thanks for good review like you said 2 3 day of battery life is nothing for a outdoor action watch i just do not know why apple do not make solar apple watch so you can be in the jungle camping for week without electricity can wait for that day,['battery']
401,disappointing for price no built in navigation map like the garmin watch which do not require a cell signal or data to update and have 16 day battery life so ultra not a useful for serious hiker or pro outdoor type,['battery']
402,bought the apple watch 6 in 2021 battery is still good i like the watch but i would not buy another one,['battery']
403,it is a great watch with good battery life that doe not feel heavy or too big on my wrist i never got a smartwatch and waited year for apple to come out with a watch like this because others apple built look like toy this look more like a real watch and the new function make it pay for itself a a dive computer is pretty expensive too i wa not sure in the beginning and my girlfriend hated the idea of a smartwatch but already after a few day we both think that it is a pretty cool device,['battery']
404,insert garmin fenix meme adventurer biker mountaineer military garmin ha gps map 2 week battery life up to infinite if you get solar if you ask any military person garmin fenix is the only watch they recommend if it lasted 1 week and did not have an orange button then maybe otherwise for that price point you will get more from the last gen fenix than an apple watch,['battery']
405,for that price i will ride with garmin forerunner 945 battery last me minimum two week putting in work with it apple been playing catch up if you ask me maybe for a inside gym quick session and going out for look yea but not for all the way outdoor fully activity like they make it seem garmin the goat of that,['battery']
406,i ended the day with 69percent battery nice hahaha i see what you did there,['battery']
407,battery life is pretty shit,['battery']
408,lol i will stick with garmin 17 day of battery,['battery']
409,69percent battery nice lmao,['battery']
410,i want the ultra to replace my series 7 because of the screen size and flatness and battery life and i do not do any of those other recreational activity,['battery']
411,you can not pack all the pro feature to one device this size they did make all of them just enough it feel like but i still would get device made specifically for the thing i am doing rather than a watch with 10 000 different feature professional deep diver will not use the ultra since it cap out at 40m 130ft professional hiker could use it but a garmin watch for example a garmin fenix 7x sapphire solar that ha the necessary feature for hiking not a smart watch tho with 28 day of battery life the ultra matron people will definitely not choose a apple watch because of comfort garmin ha the forerunner series for that a an armature athlete i use a garmin forerunner 245 music while a professional friend of mine us a 945 music both with 10 day of battery life,['battery']
412,i work in the construction field and a couple year ago i bought the apple watch i think the series 4 and within a week it wa all scratched up now the ultra with the sapphire crystal would be a game changer for me because it is way more scratch resistant and also the battery life of course,['battery']
413,comparing the battery life of a smart watch with a conventional watch make no sense they are two completely different gadget,['battery']
414,69percent battery nay,['battery']
415,great review but i think you are missing a massive subset of potential user people who need a simple rugged watch with increased battery life such a police fire and em the apple watch failed in two aspect prior it wa not rugged enough for job that require a more physical nature and the battery life required to frequent charging given some occupation is shift some firefighter and em work 48hr shift a typical apple watch would not make it through one complete shift on a single charge but taking the watch off at night to charge it would not be feasible the ultra is the first apple watch that is on the job compliant in that it can last an entire shift plus is hearty enough to take the daily physical abuse running an ultra marathon or scuba diving is a niche market that is over glamorized for apple is marketing making a watch that police fire em can wear now that is breaking into an untapped market,['battery']
416,you forget about the cycling crowd battery life is still barely enough and no ant support or able to connect ble sensor for very important thing like watt meter heart rate band to get accurate reading cadence and so on,['battery']
