,Relevant Comments,Components List
1006,i am an android guy a well and i honestly did not think i would be into having a smartwatch either but i recently hit 41 and my dr said i need to keep track of my heart rate being on new med so i went online looked for review and picked up a cheap letsfit iw2 and it is been great a a basic smartwatch with 10 day battery life i think apple watch are overkill for most people,['battery']
1007,it is certainly an impressive watch but i think most people will get it purely for the battery and increased screen brightness hopefully this trickle down to the regular watch in the future,['battery']
1008,i will wait till the next generation of the watch i need more battery life,['battery']
1009,i really do not understand how people put up with watch that have to recharged multiple time a week the pebble and amazfit have 30 day battery life all with running heart rate and sleep monitoring all at dollar50 they want to me to pay 16x more for worse battery life a screen i will almost never look at and having to shout into my wrist hard pas,['battery']
1010,while one wear a automatic watch whether a lux swiss or others youll never have to worry abt batt life ir charging and contarily smart watch big caveat is the battery life so why not make a automatic self charging smart watch,['battery']
1011,i wear my aw on my right wrist for it usefulness a activity tracker and various item while traveling i have my explorer on my left wrist a my watch left in my home timezone it ha worked well for a couple of year i think what the ultra get right is the double battery life this allows it to be what it aesthetic implies a wrist computer i will now be able to leave my iphone at home a i will be able to use aw ultra a an iphone replacement which is what i think it really is my explorer may also stay home with my iphone,['battery']
1012,3 day is battery is mediocre against garmin watch,['battery']
1013,that is a very good point i bought a 7 last year but the battery circus is annoying a week is worth should be the bare minimum,['battery']
1014,i have not had an apple watch since the series 1 and that had a bad battery i ordered this one because i like having the top end model the battery and size also sold me,['battery']
1015,this right here this is exactly what i am talking about 99percent of people buying this are buying it for the battery and because it is something new from apple,['battery']
1016,69percent battery nice 0 17,['battery']
1017,i should wait for 2nd version apple watch ultra maybe extra more battery and the black apple watch,['battery']
1018,if you want to compare the apple watch ultra with these other watch do not just point the battery life i am pretty sure that a watch that last more than the awp are not even close to it feature,['battery']
1019,2 day of battery is not enough for anything in the forest,['battery']
1020,i like how long the battery last,['battery']
1021,i did not realize the apple watch had such poor battery my watch 3 classic get 2 full day pretty easily,['battery']
1022,the dive computer and hiking feature arent a good a the dedicated stuff and wont replace them it only scratch the surface so this is just a more durable longer battery way overpriced apple watch and people will buy it anyway coz apple,['battery']
1023,damn just for the battery this seems worth an upgrade,['battery']
1024,the problem with the ultra is that in europe it priced at 999dollar and that is definitely not worth the price for a few minimal upgrade nothing too significan not regarding battery life also,['battery']
1025,huawei make battery stay up to 14 day even in pro model what is the wow factor here in battery,['battery']
1026,great video i know a bunch of people are going to drop dollar800 just for the battery alone,['battery']
1027,what about battery life under lte i constantly go on run without my phone and only have my garmin tactic delta track me and play music but would like to stream and track,['battery']
1028,if only apple would put this battery life in the regular series 8 while keeping the same size one can hope,['battery']
1029,i can guarantee the battery life of this watch would not last long enough for me to complete an ironman,['battery']
1030,you are missing a group first responder they are going to love an apple watch with longer battery life and better durability,['battery']
1031,look at the battery life of actual sport focused smartwatches answer is simple it not even close to being worth it,['battery']
1032,garmin battery life is 20 day what a joke,['battery']
1033,i do not see it being worth the money the apple watch is bulky the worst thing is a watch that slide on your wrist i can see someone banging it up against the wall pretty easily is the battery removable can it be changed like a g shock tech v functionality,['battery']
1034,2 day battery life is not enough in 2022,['battery']
1035,what a headache i have been with garmin watch bike computer and bike indoor trainer for the past 7 year and i am super happy with all their product performance yet recently i have switched to apple one i do not need spotify and so when running i can not use it on garmin not to mention listening to an audiobook now i wa thinking to upgrade to garmin fr955 mainly due to hrv running power battery the size i have pretty slim wrist and obviously the data that i have accumulated on garmin connect i know i could transfer it to ie strava but i do not want another company to have my data will wait few more week to see other review from triathletes and than decide thanks for the review a usual very useful,['battery']
1036,i bought a series 6 last year i always get two full day and night with it i did not know that wa abnormal wonder why i get so much battery life,['battery']
1037,going to sleep with about 69percent battery nice,['battery']
1038,a a normal person who definitely will not push this watch to it limit the battery life is so tempting but i know i can not justify the price because i will not use a majority of the feature this watch boast i have not ordered one yet and maybe i will maybe i will not but it is so tempting for the wrong reason,['battery']
1039,wait until he test the garmin fenix 7 the battery life will blow his mind,['battery']
1040,that wa my exact thought lol i currently use a fenix 6x but if it get to the point one of these can last through an entire backpacking trip i could absolutely see switching there is some interesting battery tech coming down the line so maybe soon,['battery']
1041,i do see the ultra a the longest battery life apple watch,['battery']
1042,my casio cost dollar15 is very slim ha a great retro aethestic that i enjoy and a 10 year battery life date alarm stopwatch timer that is all i need,['battery']
1043,when apple come out with it in black and even a little more battery life i will consider it,['battery']
1044,eventually these watch will last a full week on one charge apple and others will hopefully soon use flexible lithium ion solid state battery in the form of a battery wristband,['battery']
1045,for double the battery life too and it not like stainless steel is a expensive metal i think titanium cost more than s,['battery']
1046,of course apple watch battery is trash,['battery']
1047,even in the smartwatch world 2 day battery is not impressive,['battery']
1048,i can not imagine taking 2 day battery watch to the mountain trip sorry it suck,['battery']
1049,disappointing battery life,['battery']
1050,nice review it not fair to compare it to the similarly priced high end garmin watch maybe the dollar300 dollar400 one and then it twice the price of them garmin fenix 6x 7x we are talking 1 3 week of battery life with more gps and heart rate tracking so it still a fashion lifesytle watch and not going to be sufficient for ironman ultra endurance atheletes also i am waiting to see the tear down on how good the apple sapphire glass is i have heard rumor it significan notly softer than the garmin sapphire glass which is a game changer for a rugged watch i would love to see you do a comparision between this and a garmin fenix 7x sapphire your thought and opinion would be great to hear,['battery']
1051,there is more to a smartwatch than battery life some people like me use their smartwatch a a phone replacement and can not do that with a garmin watch,['battery']
1052,hey marque wa cellular active during your time using the apple watch the battery life is impressive a is even just for activity tracking but that would be even more insane if cellular wa active a well i am often away from my phone while doing activity so that is the most important thing for me,['battery']
1053,69percent battery life nice,['battery']
1054,wait i already have the battery saver on my series 7 but the ultra doe not have it yet,['battery']
1055,battery noice,['battery']
1056,and here i am with my gear s 3 frontier from 2018 with 3 4days avg battery aside the feature set it offer do seem quite nice and useful,['battery']
1057,even someone who prefers round watch i like the design of this one and it ha a bunch of great feature but my similar sized garmin watch ha up to 50 day and still over a month with regular use battery life i understand that this ha way more stuff that drain the battery but a week is a must in my opinion plus i am not sure how well it would work with android but that is not the point here one thing i am hoping this watch start is the bigger casing variant most watch stop at 46mm proper sport watch can go up to 51mm i could see a new ultra line from everyone with that size,['battery']
1058,a a person that work in construction and also wear an apple watch every day while working i decided to upgrade from my series 5 to this will i ever use the marathon the hiking or the diving feature probably not but the ruggedness the battery life the bright screen and how big it is all speak to my need keep up the good review mkbhd,['battery']
1059,i did not charge my smart watch for 16 day and it still had 40percent battery when i decided to charge it it only took like 10 min to charge fully a well with a 12 watt charging brick only downside is that it doe not have touch screen super pleased though with the garmin smart watch,['battery']
1060,i wonder if garmin had a good cheaper alternative with longer battery life i just need something to track work out or something,['battery']
1061,look up perpetual calendar automatic watch and be blown away of the battery life,['battery']
1062,it is crap huawei watch battery go on for 7 day,['battery']
1063,after switching to garmin i do not think i will ever switch back to apple watch 30 day of battery life solar charging extremely durable multi satellite gps ton of different workout i highly recommend the garmin fenix 7,['battery']
1064,aris routis it is phenomenal for an apple watch sure garmin is slaughtering apple in the battery life department but they are different kind of smartwatches with different usecases i like to use my apple watch a a replacement for my phone and can not do that with a garmin,['battery']
1065,apple try to play with the big boy at fitness ie garmin with this comparison is something that ha to happen and seriously now garmin is slaughtering apple battery life when my garmin fenix 6 is at one full week with most setting on and if we go to model with solar panel it is not even a fair comparison trying to say that 3 day of battery life is phenomenal just make me laugh,['battery']
1066,only a minute in but your battery life surely wa extended by your use of theater mode and funny enough i am sure how many notification your watch buzz for drastically change battery life no friend great battery lol,['battery']
1067,i have a pretty chronic case of range anxiety bigger battery always better i do not dive not really climbing everest today imagine that activity reminder you still have an hour to close your everest ring i am sold on battery alone,['battery']
1068,an ultra watch need to have atleast 2 week of battery it also need to support cycling sensor metric apart from swimming and running so this is not an ultra watch at all,['battery']
1069,you have missed out people who work in construction like me a more rugged apple watch with a bigger battery is hugely useful to me which is why i ordered one,['battery']
1070,now mkbhd ha given some point for apple to take note make it like a casio watch infinite battery and tapered edge anyway this watch is too much for me,['battery']
1071,i do not know anything about smart watch and their usual battery life but what you said in the intro about this one is battery life sounded pretty damn impressive,['battery']
1072,i have the series 5 and have no issue with it except for battery life despite the price i will be getting the ultra exclusively for the battery the waypoint feature will be fun for geocaching but realistically i do that twice a year maybe battery life is critical for me though,['battery']
1073,i have the series 5 and got it when it came out and the battery doe not last a long i am glad i pay the dollar 4 00 a month for applecare plus so when i have time i will take it to the apple store due to battery but still a good watch,['battery']
1074,same battery life wa a huge yes for me,['battery']
1075,i got the apple watch series 4 and i am unhappy with the battery life on it but other than that it doe a an apple watch should it is not the best one in the lot but i am not interested in paying more then 100 dollar for a watch that is just me,['battery']
1076,why are you comparing battery life from a black and white casio watch to basically an iphone on your wrist,['battery']
1077,2 day battery on a watch and it get a pretty good from mkbhd damn what will my smart watch with 50 day batter backup get only if it had a apple logo somewhere on it p a watch with le than 10 day battery backup is useless for me any trip or outside activity i plan i have to consider charging a silly watch that is too much pain in the a for me,['battery']
1078,exactly you are getting all the feature with more than double the battery life a well a some of the smart watch feature,['battery']
1079,would be sick to see him do a comparison between this and the fenix 7x he will then see what good battery life is,['battery']
1080,by turning of the most notification i get almost the same batterylife with my old watch 6 sad about this one only produced in silver,['battery']
1081,ok that low battery sound at 1 11 really got me i wa like damn did not i just charge my earphone last night,['battery']
1082,i want to like it and it work for most people but it is not the watch for people who do endurance sport that last 24 hour or do not want to have to charge their watch every couple day my coros vertix 2 watch ha not been charged since september 2 i have logged 27 hour of gps running during that time and it still ha 54percent battery life left the coros is also about dollar100 cheaper,['battery']
1083,apple need to design a wireless battery adapter that connects to the watch while on your wrist during sleep to charge it then in the morning you dock the battery pack and let it charge back to full and then go about your day,['battery']
1084,i like this despite the fact it is pretty useless to a lazy boy like myself battery life still suck compared to say the entire amazfit series that go past 2 or more week on a charge while still being very useful to the vast majority of folk i hope apple get that in future version great review marque,['battery']
1085,those are not very good smartwatches though partial smartwatches maybe no full fledged smartwatch so far ha more than two and now three day of actual battery life,['battery']
1086,69percent battery nice marque,['battery']
1087,if it were not so ugly and expensive i would be interested simply because of the battery life give me a non pro version with that battery apple,['battery']
1088,yeah a 3 hour workout ai not gon na burn 2000 calorie that is like 80percent of a marathon buy garmin with a battery that can last over a month,['battery']
1089,too bad i have stopped doing triathlons and recently got the series 8 and i got my garmin 945 with awesome battery life this is massive watch for my small wrist actually the normal series 8 is more wearable too,['battery']
1090,i feel there is a limit to how smart a watch need to be i used to have an android based smart watch and the battery life wa poor now i have a garmin venu sq it doe all the fitness health tracking i need ha phone notification and medium control yet the battery last all week it is just the right amount of smart,['battery']
1091,feel like the watch 5 pro is a better choice 90percent of the feature much better battery life and like half the price,['battery']
1092,the bigger battery is nice but that thing look like too much of a chonker for my wrist,['battery']
1093,can we just get a regular one with better battery life,['battery']
1094,having worn sapphire crystal all my life the isapphire scratching at mohs scale 6 is a deal breaker for me i need a rugged watch for mountain biking like my fenix 6 i get two full week battery including weekend ride dual gps already and zero scratch on the screen after eighteen month,['battery']
1095,i have the black stainless steel series 4 and there is not a single mark anywhere on it after four year my mom ha a regular aluminum series 5 and it is covered in surface wear micro scratch all over the screen i can not speak for how well it would hold up in heavy outdoors activity i am very much an inside person but for normal use the sapphire crystal is far more durable than the glass in the regular watch i have been looking at getting a new one maybe this year or next year but probably next year i still get two day out of my battery with my light use,['battery']
1096,i know is not possible due to battery size but i wish there wa a smaller one,['battery']
1097,69percent battery nice hahaha,['battery']
1098,i guess you have an inevitable relationship with 69percent battery in your life,['battery']
1099,1 11 my ptsd kicked in when i heard that low battery sound just suck to hear it on your airpods,['battery']
1100,richard blahou ek a a hunter hiker i bought a garmin fenix 6 sapphire to replace my apple watch i got so tired of having to charge it my hunting buddy ha a garmin and i got jealous of his battery life and never needing to charge i can go 15 day without charging and that includes sleep monitoring my mind is blown,['battery']
1101,that is really good battery life damn,['battery']
1102,damn that battery backup,['battery']
1103,been waiting for this review i just wish that battery life wa a little longer do not get me wrong 2 day is a good amount but i just want 5 7 day battery life p awesome content a always though and i will defiantly be looking to buy at some point soon,['battery']
1104,keaton anderson i would fully take a few le of the smart feature for that longer battery life garmin style they last 4 5 day,['battery']
1105,keaton anderson fr 5 7 day battery life is insane something that doesnt exist in any piece of tech anywhere,['battery']
1106,dude be wanting a rubix cube size watch on his wrist for a week long battery life we getting closer but tech doe not seem to be there yet,['battery']
1107,best thing about having a watch too is when your phone battery dy or you forget to charge it you can use your watch,['battery']
1108,mine came with a dead battery and no screen film it wa some weird little cardboard sleeve it look new but i have a feeling it is a used watch,['battery']
1109,i am always disappointed with battery life of apple watch,['battery']
1110,ryam they have but it is basic physic that limit it i think the battery ha more than enough on the series 8 and ultra it is a computer phone and walk in talkie on your wrist using it take power,['battery']
1111,ahh but i mean why apple can not improve battery life,['battery']
1112,the only thing i expect is a far better battery life for both the 9 or x and the ultra,['battery']
1113,all i want is just a decent battery,['battery']
1114,give me battery and a better fitness app,['battery']
1115,i hope they can improve battery life or solar powered version,['battery']
1116,honestly i do not like how long the apple watch battery last pretty bad compared to competitor,['battery']
1117,my wish list 1 cgm 2 body composition 3 bp 4 tue all day battery life of 24hrs without low power mode chance are apple will switch all production line to 3nm this barring any technical or yield issue,['battery']
1118,improved battery life will probably be the reason why i am waiting for the series 9,['battery']
1119,oh f these battery duration le than one day is just ridiculous,['battery']
1120,if apple watch next year come with battery and solar they can compete better with garmin they would sell fast like hotcake,['battery']
1121,how can i find a apple watch 8 that ha a dead battery,['battery']
1122,i have a 40mm series 4 and a very small wrist the 44 mm wa too big in my wrist so i have not upgraded to the ultra i just want a longer battery life,['battery']
1123,i would like to be able to see my note on my watch and have different ringtone option or like when someone call you both your phone and watch go off have that for all notification i realize this is too much to expect but it would also be awesome if battery lasted at least 2 day,['battery']
1124,i can confirm from experience with the gear s3 s4 and s5 that the battery life on samsung watch is misleading i can barely get 1 5 day and this with low power mode low brightness they are not defect watch went to samsung got replacement it just how they are,['battery']
1125,this year i am getting a series 8 apple watch from a 3 so i am exited and i think they should do the band a a external battery for way better better life,['battery']
1126,a band with extra battery would be nice,['battery']
1127,i wish apple would make a fitness tracker their power efficiency in a tracker would yield awesome battery life and i just want a tracker that is optimized for apple health,['battery']
1128,thank you for the review daniel if the next iteration of apple watch include the smart connector for it wrist band it could easily incorporate battery within the band for longer use one could then swop between conventional wrist band over battery equipped one depending on use case scenario,['battery']
1129,apple will focused on battery life this time apple watch series 9 s9 chip based on 5nm technology bmi sensor new band apple watch ultra 2 s9 chip based on 3nm technology bmi sensor new color new band,['battery']
1130,hmm better battery sound great but i would also like a 44mm watch ultra the current watch ultra is too big,['battery']
1131,when the battery it s gon na last 1 week i ll buy one,['battery']
1132,i do not see the design changing anytime soon folk were predicting huge jump since the s7 and that did not happen with even with the s8 the battery life improvement would be cool but nothing worth waiting for if at all most change will probably come with the watch ultra 2,['battery']
1133,i got the ultra this year and although it wa very expensive i love it much more durable better battery life and perfect screen size,['battery']
1134,expensive it costed me a weekly income although yeah i love the alarm and the bigger case not to mention the battery it went from 100percent to 0percent in about 3 day and it charge extremely fast when i have for example 30percent i just charge it while i shower and it is already at 100percent when i put it on again,['battery']
1135,hi dan i will be upgrading next year got to keep up with the tech i am hooked now just hope battery life is better than the 8 though compared to my old 6 it is a lot better xx,['battery']
1136,i have always imagined an apple watch with smart connector and tiny battery in the strap to extend battery life,['battery']
1137,i would love to see a upgraded apple watch ultra with more battery power and few additional change to make it more interesting,['battery']
1138,it ok but the battery is terrible unfortunately,['battery']
1139,how many percent is your series 4 battery capacity after 4 year,['battery']
1140,une full day battery life amazing,['battery']
1141,if your watch is a gps model i e without cellular function or not set up with cellular it would not be able to access the internet without an iphone cellular version can but it drain your watch is battery if you have the cellular version and set up the plan you can use it stand alone for phone call streaming music with bluetooth and using map other than that you would need your iphone,['battery']
1142,how about degradation of battery in this 800 day is posible to replace it at an apple store,['battery']
1143,got mine free from apple developer academy so i am very happy i got my first ever smartwatch and i have been hearing nothing but good thing about this i do not really mind the battery life so yeahh,['battery']
1144,what is the battery health percentage after 800 day,['battery']
1145,guneet singh i used it heavily today 3 hour walk and i made it to nighttime with like 5percent of the battery so i just charge it when i sit on my desk and put it back on,['battery']
1146,doe not the cellular version finish battery quickly,['battery']
1147,how long did your battery last at the end,['battery']
1148,jstmelon loool i meant apple watch series 4 yeah no lol my iphone 12 mini ha like 5 hour sot at best and i just replaced the battery the watch easily last all day though,['battery']
