,Relevant Comments,Components List
719,even mkbhd could not resist saying nice after 69percent battery,['battery']
720,if i were to get it it is for the battery but it is not even the best on the market so maybe not,['battery']
721,the thing that sold me on it wa the titanium case it wa available with the series 7 for a premium price tag also this year the only non aluminum model of the series 8 wa the stainless steel case and that cost dollar750 for the 45mm model for another dollar50 i decided it wa a no brainer to get the ultra and get the added feature and the added battery life no one ha mentioned there is a stainless version series 8 and comparing that with the ultra when it come to feature and price,['battery']
722,why do you switch the wrist you wear the watch i have no need for all the marathon and hiking feature but to spend dollar800 for a bigger and stronger screen with better battery life is a no go,['battery']
723,my garmin fenix 6x pro ha a battery life of 21 day if i just use it a a watch if im using gps navigation it 60 hour apple is getting there somewhat but that touch screen is killing that battery cool feature but impractical for a hardcore endurance watch for someone like me who spends day in the backcountry you need the durability and battery life lot of rock and shit out there in the wild folk,['battery']
724,hey you make the faintest comment towards garmin here but show simple digital watch while doing so i feel you are doing them and your viewer a big disservice have you used one i have the fenix 6 pro from a few year ago and it ha mostly all these feature from the ultra and have done for a few year i am not knocking the ultra it is really cool just the fenix is really cool too so why do not you review them or at least make yourself informed on what other watch are in this field that are similar in price and feature to this ultra the fenix 7 ha better battery ha the dual gps ha the smart gps pinging and more it is not something i take off after a workout appreciate you talking with people who actually use these kind of watch though garmin also ha better biometric tracking than apple fwiw,['battery']
725,use of do not disturb help with battery you had it on during practice,['battery']
726,samsung galaxy watch battery time amp price r better than apple watch,['battery']
727,the aesthetic are terrible and i can not imagine the fitment is any better especially under long sleeve or jacket too much brick even with improvement in battery,['battery']
728,imo i can not justify the upgrade to this thing even though i have a series 5 battery is the biggest issue for me on mine but i am not paying double for an extra day of battery they failed with that and should have offered an ultra lite version in stainless steel for 499,['battery']
729,while i agree with the target audience for this new watch i do not fit it any of them i go running and walking but i am not a marathon runner but the thing that keep making me ping between garmin and apple is the battery life of the garmin the screen visibility in bright light the ruggedness and the battery life i went for a run earlier with my series 7 watch and the curved glass edge made it a nightmare to see in bright light due to the reflection plus i have scratched almost every apple watch i have ever had hoping this new one is the perfect blend for my need which is heavy on the apple integration and ecosystem but with some of the more rugged feature,['battery']
730,great video exactly a you mentioned two day of battery life is kind of bad i have had some pretty cheap huawei smartwatches for over two year now and they still last for 6 day they did 10 day when they were new i do not understand why apple can not do the same,['battery']
731,prior to the apple watch series 0 released in 2015 i wore a limited edition eli manning citizen watch it is a big watch but i never thought it to be too big for my wrist the apple ultra watch is slightly smaller and since i have owned every release of the aw always in stainless i see no reason why i would not purchase the ultra i am a middle to long distance runner the always on screen and the generally larger screen are other compelling reason this watch will be mine the increased battery life without doubt is a bonus i already get nearly 2 full day of battery life out of my current series 7,['battery']
732,just give u a regular or se model that can keep a battery life a long a fitbit smart watch that cost 1 2 the price lol,['battery']
733,90percent of people ive seen with watch like the garmin fenix do not gey use from them the top feture id from them that is actually useful is topo mapping but even then you have limited battery life when it come down to it most hard core adventure type wan na keep tech out of the back county experience,['battery']
734,apple user be like the watch ha great battery that last 3 day and we will gladly pay you 800dollar for it meanwhile you can buy the same thing for 1 4 of the price with battery that last 2 week easy i will never get it for me this is the worst value you can get paying only for the brand it is absolutely ridiculous,['battery']
735,they still need to up battery having to charge every 2 day is a no go for me and even sooner if you use the function more i will stick with my garmin,['battery']
736,i paid more just for titanium in the series 6 this is a no brainer for le price and way more feature including battery life which help all type of user,['battery']
737,i am a standard guy no ultra sport here but i like big watch and increased battery life is enough for me to go with ultra on top of that why i should pay the same for series 8 cellular when ultra cost the same with ton of feature more doubled battery life,['battery']
738,could apple possibly be saving the pro name for the non extreme athlete user i would still love a sapphire glass better battery brighter screen but do not need much else from the ultra,['battery']
739,imo this watch is trying to capture more of the men is watch market the design is catered to the men is market i know many men and i am one who still do not wear a smart watch because of concern about durability battery life size and feature my watch for backpacking climbing etc is a casio pro trek like the one you showed with an altimeter compass and solar charging my daily watch is a seiko solar chronometer both never need charging are rated water resistant to 100m static pressure and tell me what i need to know both are about 1 3 the price of this and are much higher performing in the way that matter to me,['battery']
740,the apple watch ultra is on my radar simply because of it battery life brightness and action button assignment i would highly prefer a black version of this for reason stated in the video,['battery']
741,using the airpods low battery sound in the intro threw me for a loop lmao,['battery']
742,in 6 month and 3 update the watch will do 5 hour battery and get hot just in time for the next dollar900 version next year,['battery']
743,i am absolutely the audience for this i am a qualified diver recreational and technical a fairly regular hiker mountain biker multi day wilderness trekker and a regular runner gym goer prior to this the only realistic option for people like me to have an all in one device wa the garmin descent mkii google the price though and look at how dated it already look and you might see why i have not made the leap just yet from my current combination of garmin fenix 6 and a basic mare recreational dive computer in reality most of my dive are usually single cylinder recreational dive and this is the case for most tech diver i have come across for a number of reason that go well beyond this post this aw is therefore a really tempting option for me a for anything technical i have two separate computer anyway the one other major hassle this would solve would be the constant changing between watch on the boat before after kitting up taking kit off pre and post dive it doe not sound like a big problem but dive boat are busy place with heavy equipment knocking around so every time i take my fenix off i always have to worry about it being either lost or broken not an issue if you never have to change watch in the first place regarding trekking i wa worried about the battery life initially but in reality i only get about three or four day of battery including tracking storm alert etc from my garmin when outdoors anyway despite the amazing standby of around 2 week i and most trekker i meet these day tend to a carry battery pack s anyway so the battery life is not really a huge problem with the performance that marque is seeing all in all i am seriously considering this a my first apple watch a day i thought would never come,['battery']
744,i really do not get why it is still getting compared with garmin my 955 almost half the price last more than 10 day with 6 of them being active around 13 15 hour in total of gps on the super extra gps setting and sleep tracking it ha an amount of sport that i would not do in my entire life ha some insane algorithm and training data and it is so light i do not even feel i am wearing it i get that it is a cool product for apple but in my opinion it is just incomparable with garmin i mean garmin ha some watch that their battery would last almost forever with that being said you are a legend mate keep up the awesome work,['battery']
745,the whole thing is just another apple gimmick the 99percent of people who will buy this are buying it for the battery life and because it is something new from apple they could have just upgraded the standard apple watch with the feature that 99percent of people buying this want,['battery']
746,i feel that the battery life is not enough i have a garmin fenix 7 and it last me a week without charging such a great experience,['battery']
747,crap battery life compared to coros garmin other fitness watch,['battery']
748,quite a comprehensive review of the new apple watch ultra i am interested in purchasing it due to the enhanced battery life and ruggedized construction i do hope that apple doe not upgrade the apple watch ultra every year a they do with the standard apple watch,['battery']
749,why do not they curve the underside of the watch kind of easy to do if you have several size and add a huge amount of comfort and battery space,['battery']
750,the nice on 69percent of battery got me,['battery']
751,i just use a mechanical watch and never have to worry about battery,['battery']
752,i wish it had a battery for like 4 5 day just to keep up with other fitness tracker,['battery']
753,i know that garmin watch have 6 7 day of battery power so this pro watch is nothing special,['battery']
754,i am curious to get this one a well i have a series 4 the battery ha degraded down to 75percent and sometimes deloads it charge overnight i like the orange accent and the size of the watch and some of the watch face infographics i am not that active but the price of the ultra is barely more than a stainless steel watch which people get all the time otherwise they would not even offer it to me it is not that absurdly expensive for a watch that last 4 year or more,['battery']
755,do you need an iphone to make it work or can you use it with an ipad our like someone else is friend parent iphone hmm weird question but i am not sure i am able to choose between this an samsung watch or an withings watch a someone looking for long battery life sleep and heartrate tracking,['battery']
756,my issue with apple watch series 7 cellular is battery life if you do not want to bring your phone somewhere for a few hour and you are taking call streaming music etc i am not always getting to the end of the day on a single charge and i think releasing yourself from your phone and only using the watch on cellular is the huge selling point of even having the watch,['battery']
757,i mostly only upgraded because of the battery after a year of battery degradation the battery on the apple watch wa already getting too close by the end of the day and the apple watch is not a device i will be upgrading every year more like every 3 or 4 year so the le often i need to pay to have the battery replaced the better with how i use the current apple watch i wa annoyed with having to recharge it in the same day for it to comfortably last before i went to bed which left no room for sleep tracking or just made doing so an inconvenience i like the idea that i will probably only have to charge the ultra while i am showering to ensure it never dy,['battery']
758,trading in my series 5 gold stainless for a series 8 gold stainless and also getting the ultra series 8 will be my dress up watch and the ultra i will wear pretty much all the time not into the extreme activity shown for the watch i just like the aesthetic longer battery life brightness and ruggedness i think there are more people like me out there than apple think there are who will get this watch,['battery']
759,i want one of these just for the battery life there have been time when i have had to take the series 6 off and put it on the charger a couple hour before bed far earlier than i normally would just because i happened to work out for an extra hour or so that day i do not even use it for sleep tracking i wear it from about 8am to about midnight do a 2 3 hour workout in there somewhere if i am not being lazy and it is usually down to around 10 15percent by the end of the day i also avoid using the cellular feature or even having it away from my phone ever to avoid the cellular antenna turning on,['battery']
760,man that battery life is sounding almost like a garmin,['battery']
761,a an amature runner and hiker the garmin is battery is crucial and everything lasting a day and a half like the previous watch is a no go with everything in the apple ecosystem an apple smartwatch is a huge attraction my one gripe and the reason i will not buy it right now it is a rectangle,['battery']
762,my 5 6 year old samsung gear s3 frontier is black and none of the color is peeled and i still after all this time get two day plus of battery life original battery imagine that,['battery']
763,look great but i think im gon na keep my series 7 for awhile my series 2 lasted like 6 year till the battery started dying quickly,['battery']
764,i honestly have to say that i am excited for mine to come on friday even though i am not an extreme outdoors athlete or trainer i do go walking hiking almost every day and find that the improved battery life of the ultra with it extended battery life mode coming later this year to be enough of a reason to upgrade also a marque put it this is basically a pro model that offer feature that more avid hardcore user of the apple watch can appreciate all of the new upgraded hardware feature of too bad that there is not a slightly better processor than the series 8 or se 2 built in but hey for the first time ever in the apple watch is 7 year history this edition actually ha more going for it for the price than just the outer casing which when compared to the series 7 edition is that much more of a bargain for the price i will be doing my own first impression unboxing when i get mine friday but i already know that barring some major unforeseen flaw or regret i plan to keep this until at least next year when we see if how apple evolves this new line of apple watch,['battery']
765,huawei is on another level for dollar500 i have a fully titanium watch and strap sapphire face with 14 day of battery life or 8 day of heavy use with all the same sensor workout tracking sleep tracking etc and it look classy or go with the older version for dollar200 and get the same thing with just slightly worse interface,['battery']
766,i am grabbing it for the battery screen size and ruggedness i love my apple watch and it is been to hell and back with me and is pretty worse for the wear because of it here is hoping the ultra hold up much better,['battery']
767,i want dollar300 dollar400 apple watch that ha a week long battery life i currently use a cheap dollar50 smart watch which get two week of battery life so i do not think it is too much to ask for lol,['battery']
768,it is an expensive woman repeller if it were not and looked anywhere presentable at a dinner or a party it would be worth it just for the extra battery it would just last longer and pay for itself they should have still kept the regular titanium option for people who wanted sapphire glass but not the weight of steel and were still into getting as,['battery']
769,marque 69percent battery nice,['battery']
770,good honest review feel like the sensible me ha just said nope you do not need it so i will live in hope of some low power apple fitness band with 5 day battery the market is there apple you just need to get to and get it,['battery']
771,apple hasnt thought of another group of user like me cheapskate i use a dollar50 smartwatch with battery that last more than a month amazfit bip,['battery']
772,so according to apple that all the one outside of your illustration circle are all male you are lucky you are a male this watch really suck for small boned small wristed female i would like to take a watch on an extended hike not unite a pct or other through hike but segment when i can afford the time to go so a a woman i have to settle for a gps watch that doe not have the accuracy and the battery life apple really need to hire more woman in product design curtis machale talk about this in one of his video on a book review about how item are mostly designed for men and that woman just have to be subjected to crap like this even those other watch you have shown i have seen model for woman,['battery']
773,fun fact i have casio watch that my brother got for his 7th birthday he is now 22 year old and the watch is still running on the same battery it came with,['battery']
774,amazfit gtr2 7 day battery,['battery']
775,garmin watch battery last a week,['battery']
776,i do not do any of the advertise usage for this watch yet i still bought one because i personally like the new flat screen look and the bigger battery is also a plus for me,['battery']
777,let is just buy it for battery life,['battery']
778,i hate the smart watch from apple and samsung i wear 2 watch currenly 1 2 88 inch full android one which is basically a full tiny smartphone that need to be chrarged every night and a cheaper one one my other wrist that last well over a week on a charge for health tracking i would like to get one that would be somewhere in the middle with functionality and battery life but no one make anything i would even concider for any price,['battery']
779,wait you compared a normal watch to a smart watch for battery life that doe not make sense,['battery']
780,i believe that serious sporty person those who are not going outdoors just for the pic will go with better more specialized and obviously with better battery choice such a garmin sunto etc,['battery']
781,wow 2 day few year ago huawei released their watch watch with 2 week of battery life with same feature ant cost 4 time lower american,['battery']
782,why is nobody asking why apple watch chipset is not more energy efficient adding more battery and bulk isn the way,['battery']
783,a a skier this product seems very appealing being to go to the mountain and go into 10 degree weather without any worry seems very appealing a well a going camping for a multiday weekend and not needing to worry about the battery life,['battery']
784,bad battery if you compare to even some 200dollar watch,['battery']
785,i am a serious hiker backpacker and i still do not see this a a good sell for people like me dollar800 for the thing and needing to charge it every 2 day is just a dead weight in my backpack once it dy i would rather bring my phone and use gaia gps for navigation and have a backup real map and compass for navigation if my phone dy which lead me to my next point i would want my phone charger to power just my phone and recharge my garmin inreach which would actually be useful in an so situation something the ultra doe not do i think if apple added the so function the way they did on the iphone 14 it would make it somehow more useful but first and foremost is battery life which would need to be improved for going on multi day adventure,['battery']
786,still garmins last for week if not month on battery like if i would be into so demending sport or working in rough environment garmin it is just a better choice,['battery']
787,like most i stare at my damn phone way too much a much a i try to minimize my usage the temptation is often too much to overcome this is why i love my cellular apple watch leaving my phone behind make it impossible to go down a rabbit hole and force me to be present i look at all the people at the gym staring at their phone instead of working out and realize i would be just like them without it the battery put the brake on that pretty quick and the screen size mean you are left squinting though this watch fix all of that for me,['battery']
788,well i am a wheelchair patient so i do not do activity like hiking or diving etc but there are still some nice feature that this bigger apple watch ultra ha that appeal to me especially the bigger battery life since i can get longer out of this watch for my heart rate measuring it ha a nice big screen which i also really like i do like the orange color of the button a well though i also wish it would just come in black now a a fashion jewel i must say there are still big watch that people wear and go on special event on with and even though these watch are mostly truly jewel rolex they are also big if you wear the apple watch ultra you could use a more muted band maybe some type of off white or something like that which would color match the awu i think i might get this watch i am not completely sure yet the price is also something to consider a in my country the awu cost dollar1k,['battery']
789,battery life is the only reason i want own one i never take a watch off,['battery']
790,i do not run swim or hike i just want a bigger watch face and longer battery life over my series 5 that last 16 hors max getting my ultra this friday,['battery']
791,69 percent battery markass nice,['battery']
792,i just wish my watch 3 battery wa not expanding apple bud that pretty well while they were still selling it,['battery']
793,i did not know that apple watch had such horrible battery life before this video the fact that two day is great is kinda sad a someone who wear a mifit 5 band for two week straight before washing it and charging it i find that anything larger than a bracelet and without at least a week of battery life would be too cumbersome the only feature that i feel like i am missing nfc and being able food to a calorie tracker or starting ending a fast for me apple watch a it is already have a narrow appeal a they only attract apple user who do not have good comparability option having to constantly take it off and recharge at best every two day brings down from being a watch to another electric device to babysit i always thought people bought them becouse they had good feature i guess not lmfao,['battery']
794,i feel like a large segment i fall into is missing people that cycle loooooong distance i ride century frequently and even though i may use a dedicated bike computer for speed cadence and the like i still use my apple watch for heart rate zone monitoring and calorie counting i can not make it through a full century without charging my watch i am upgrading my old series 4 to the ultra specifically for the battery life and gps a it relates to long distance cycling,['battery']
795,charged my garmin fenix 6 pro x about a week ago 11 day left exercised and or cycled every day with gps and heart rate transmit feature on i upgraded from an other garmin a a 3 day battery on a watch is unacceptable for me just my 2c i use about zero smart watch feature other than exercise and health tracking also my last watch had touch worst thing for a sport you do in glove and rain and mud,['battery']
796,also the lack of ant support is a big issue for bikers e bikers you can not transmit heart rate or talk to speed cadence or e bike sensor either nor ant ant enabled gym machine generally i saw a similar response to mine on every bike video on this watch it is nice if you ride once a week if you want 24 7 tracking and long battery and ant support then this would work a a 2nd watch for office day or hanging out i understand why people like it and i want one too the problem is that it would end up in the drawer next to the other gadget i wanted then replaced with others that i needed,['battery']
797,i am an average college student at purdue university so my apple watch series 4 ha been great for my need i play disc golf on the purdue team and waypoints could be game changing being able to set them during a practice round will allow me to see where the basket is on blind tee shot see where my shot ending up in the past and have a better idea of the course the ability to measure how far my throw using waypoints is also super helpful information for consistency all this with a brighter screen and longer battery life wa hard to ignore i wa excited before watching your review but now i can not wait,['battery']
798,unless these become compatible with regular magsafe it is not worth it to me i also feel like watch should have a week worth of battery i can not take measuring a watch is life in hour that being said this is coming from someone who is iphone 13 pro is at 93percent battery capacity so i am probably a worst case user,['battery']
799,i liked the last plugin about the mkbhd i am only worried about the size of it which is crucial for the battery life but may hinder day to day activity i suppose,['battery']
